{
  "case_id": "FAS-012",
  "benchmark_version": "0.1.0",
  "schema_version": "0.1",
  "title": "Vulnerable but Unreachable Dependency",
  "description": "The dependency contains vulnerable functionality, but execution-path evidence is intentionally insufficient to establish whether application control can reach it.",
  "category": "C6_SUPPLY_CHAIN",
  "categories": [
    "C6_SUPPLY_CHAIN"
  ],
  "difficulty": "L3_MULTI_COMPONENT",
  "status": "VALIDATED",
  "scenario": "The dependency contains vulnerable functionality, but execution-path evidence is intentionally insufficient to establish whether application control can reach it.",
  "security_condition": "INSUFFICIENT_EVIDENCE",
  "attacker_model": "Normal application attacker; no unsupported hidden runtime assumptions.",
  "environment": {
    "validation_type": "STATIC",
    "network": "none",
    "credentials": "synthetic-only"
  },
  "repository": {
    "uri": "cases/FAS-012/repository",
    "commit": "phase3-initial",
    "artifact_digest": {
      "sha256": "cfb3690460dd314c7f6f8675c8e1cff578be58a4affb21a560486475f76fc5dd",
      "media_type": "application/json",
      "origin": "BENCHMARK"
    }
  },
  "metadata": {
    "case_version": "0.1.0",
    "lifecycle_status": "IN_REVIEW"
  }
}
