{
  "case_id": "FAS-005",
  "benchmark_version": "0.1.0",
  "schema_version": "0.1",
  "title": "IDOR",
  "description": "An authenticated low-privilege user can retrieve another user's object because authorization is based on a caller-supplied object identifier.",
  "category": "C3_AUTHENTICATION_AUTHORIZATION",
  "categories": [
    "C3_AUTHENTICATION_AUTHORIZATION"
  ],
  "difficulty": "L2_MULTI_FUNCTION",
  "status": "IN_REVIEW",
  "scenario": "An authenticated low-privilege user can retrieve another user's object because authorization is based on a caller-supplied object identifier.",
  "security_condition": "REACHABLE_TO_SINK",
  "attacker_model": "Authenticated user has only their own-resource permission and knows a second object identifier.",
  "environment": {
    "validation_type": "STATIC",
    "os": "linux",
    "runtime": "python3.12",
    "network": "none",
    "credentials": "synthetic-only",
    "resource_limits": {
      "cpu": "1",
      "memory": "256MiB",
      "timeout_seconds": 30
    }
  },
  "repository": {
    "uri": "cases/FAS-005/repository",
    "commit": "phase3-initial",
    "artifact_digest": {
      "sha256": "0000000000000000000000000000000000000000000000000000000000000000",
      "media_type": "application/json",
      "origin": "BENCHMARK"
    }
  },
  "metadata": {
    "case_version": "0.1.0",
    "environment_version": "0.1.0",
    "provenance": "SYNTHETIC",
    "lifecycle_status": "IN_REVIEW"
  }
}
