{
  "case_id": "FAS-010",
  "benchmark_version": "0.1.0",
  "schema_version": "0.1",
  "title": "Safe MCP Server",
  "description": "The MCP server exposes powerful functionality but authentication, schema validation, path allowlisting, and authorization constrain effective capability.",
  "category": "C5_MCP_SECURITY",
  "categories": [
    "C5_MCP_SECURITY"
  ],
  "difficulty": "L4_AGENTIC",
  "status": "VALIDATED",
  "scenario": "The MCP server exposes powerful functionality but authentication, schema validation, path allowlisting, and authorization constrain effective capability.",
  "security_condition": "BLOCKED_BY_AUTHORIZATION",
  "attacker_model": "Attacker may control tool arguments but not server policy or credentials.",
  "environment": {
    "validation_type": "STATIC",
    "network": "none",
    "credentials": "synthetic-only"
  },
  "repository": {
    "uri": "cases/FAS-010/repository",
    "commit": "phase3-initial",
    "artifact_digest": {
      "sha256": "5dd2bcd5efb3cdd279fe0ed4c14ae30f72bf61425aa91125eb116d1cfe4b0e4d",
      "media_type": "application/json",
      "origin": "BENCHMARK"
    }
  },
  "metadata": {
    "case_version": "0.1.0",
    "lifecycle_status": "IN_REVIEW"
  }
}
