{
  "case_id": "FAS-015",
  "benchmark_version": "0.1.0",
  "schema_version": "0.1",
  "title": "Public Storage Exposure",
  "description": "Effective storage policy permits anonymous read access to the protected object.",
  "category": "C8_INFRASTRUCTURE_CLOUD",
  "categories": [
    "C8_INFRASTRUCTURE_CLOUD"
  ],
  "difficulty": "L3_MULTI_COMPONENT",
  "status": "VALIDATED",
  "scenario": "Effective storage policy permits anonymous read access to the protected object.",
  "security_condition": "CONTROL_BYPASS",
  "attacker_model": "Unauthenticated network attacker may request the object but cannot modify IAM configuration.",
  "environment": {
    "validation_type": "STATIC",
    "network": "none",
    "credentials": "synthetic-only"
  },
  "repository": {
    "uri": "cases/FAS-015/repository",
    "commit": "phase3-initial",
    "artifact_digest": {
      "sha256": "0000000000000000000000000000000000000000000000000000000000000000",
      "media_type": "application/json",
      "origin": "BENCHMARK"
    }
  },
  "metadata": {
    "case_version": "0.1.0"
  }
}
