{
  "case_id": "FAS-016",
  "benchmark_version": "0.1.0",
  "schema_version": "0.1",
  "title": "Privilege Boundary",
  "description": "A broad identity permission is overridden by an effective explicit deny boundary that blocks privilege escalation.",
  "category": "C8_INFRASTRUCTURE_CLOUD",
  "categories": [
    "C8_INFRASTRUCTURE_CLOUD"
  ],
  "difficulty": "L3_MULTI_COMPONENT",
  "status": "VALIDATED",
  "scenario": "A broad identity permission is overridden by an effective explicit deny boundary that blocks privilege escalation.",
  "security_condition": "BLOCKED_BY_RESOURCE_POLICY",
  "attacker_model": "Attacker has the listed principal but cannot alter the deny boundary.",
  "environment": {
    "validation_type": "STATIC",
    "network": "none",
    "credentials": "synthetic-only"
  },
  "repository": {
    "uri": "cases/FAS-016/repository",
    "commit": "phase3-initial",
    "artifact_digest": {
      "sha256": "0000000000000000000000000000000000000000000000000000000000000000",
      "media_type": "application/json",
      "origin": "BENCHMARK"
    }
  },
  "metadata": {
    "case_version": "0.1.0"
  }
}
