{
  "case_id": "FAS-004",
  "benchmark_version": "0.1.0",
  "schema_version": "0.1",
  "title": "Indirect Command Injection",
  "description": "HTTP input is persisted and later consumed by a worker that interprets it as a command.",
  "category": "C2_DATA_FLOW_TAINT",
  "categories": [
    "C2_DATA_FLOW_TAINT",
    "C9_CROSS_COMPONENT_ATTACK_PATHS"
  ],
  "difficulty": "L3_MULTI_COMPONENT",
  "status": "IN_REVIEW",
  "scenario": "HTTP input is persisted and later consumed by a worker that interprets it as a command.",
  "security_condition": "REACHABLE_TO_SINK",
  "attacker_model": "Unauthenticated attacker may submit persistent data and trigger the worker.",
  "environment": {
    "validation_type": "STATIC",
    "network": "none",
    "credentials": "synthetic-only"
  },
  "repository": {
    "uri": "cases/FAS-004/repository",
    "commit": "phase3-initial",
    "artifact_digest": {
      "sha256": "9af9f5a36846634ce85ddf66ea2e047643cde70afac4503ce5af9d979cab3fde",
      "media_type": "application/json",
      "origin": "BENCHMARK"
    }
  },
  "metadata": {
    "case_version": "0.1.0",
    "lifecycle_status": "IN_REVIEW"
  }
}
