{
  "case_id": "FAS-017",
  "benchmark_version": "0.1.0",
  "schema_version": "0.1",
  "title": "Multi-Service Compromise",
  "description": "Attacker-controlled frontend data crosses API and worker trust boundaries into an internal administrative service.",
  "category": "C9_CROSS_COMPONENT_ATTACK_PATHS",
  "categories": [
    "C9_CROSS_COMPONENT_ATTACK_PATHS",
    "C3_AUTHENTICATION_AUTHORIZATION"
  ],
  "difficulty": "L3_MULTI_COMPONENT",
  "status": "IN_REVIEW",
  "scenario": "Attacker-controlled frontend data crosses API and worker trust boundaries into an internal administrative service.",
  "security_condition": "REACHABLE_TO_SINK",
  "attacker_model": "Unauthenticated public attacker can submit the frontend request and trigger the worker.",
  "environment": {
    "validation_type": "STATIC",
    "network": "none",
    "credentials": "synthetic-only"
  },
  "repository": {
    "uri": "cases/FAS-017/repository",
    "commit": "phase3-initial",
    "artifact_digest": {
      "sha256": "d7fdab486978012321fd012d06908cb52be823e31466fb9576edc73e0044d276",
      "media_type": "application/json",
      "origin": "BENCHMARK"
    }
  },
  "metadata": {
    "case_version": "0.1.0",
    "lifecycle_status": "IN_REVIEW"
  }
}
