{
  "case_id": "FAS-013",
  "benchmark_version": "0.1.0",
  "schema_version": "0.1",
  "title": "Revoked Secret",
  "description": "A historical synthetic credential was exposed but deterministic revocation prevents current authentication.",
  "category": "C7_SECRETS_SENSITIVE_DATA",
  "categories": [
    "C7_SECRETS_SENSITIVE_DATA"
  ],
  "difficulty": "L2_MULTI_FUNCTION",
  "status": "VALIDATED",
  "scenario": "A historical synthetic credential was exposed but deterministic revocation prevents current authentication.",
  "security_condition": "REMEDIATION_BREAKS_PATH",
  "attacker_model": "Attacker knows the historical synthetic credential but has no alternate credential.",
  "environment": {
    "validation_type": "STATIC",
    "network": "none",
    "credentials": "synthetic-only"
  },
  "repository": {
    "uri": "cases/FAS-013/repository",
    "commit": "phase3-initial",
    "artifact_digest": {
      "sha256": "7697fb6e785df5d6fc82d02197fd50ef2bc6999e5a3dc98e8ac55c5925036883",
      "media_type": "application/json",
      "origin": "BENCHMARK"
    }
  },
  "metadata": {
    "case_version": "0.1.0",
    "lifecycle_status": "VALIDATED"
  }
}
