{
  "case_id": "FAS-019",
  "benchmark_version": "0.1.0",
  "schema_version": "0.1",
  "title": "Verified Fix",
  "description": "A webhook signature control blocks the previously viable privileged action while preserving valid signed requests.",
  "category": "C10_REMEDIATION_REGRESSION",
  "categories": [
    "C10_REMEDIATION_REGRESSION",
    "C3_AUTHENTICATION_AUTHORIZATION"
  ],
  "difficulty": "L3_MULTI_COMPONENT",
  "status": "VALIDATED",
  "scenario": "A webhook signature control blocks the previously viable privileged action while preserving valid signed requests.",
  "security_condition": "REMEDIATION_BREAKS_PATH",
  "attacker_model": "Attacker can send unsigned requests; only the synthetic signer can produce a valid signature.",
  "environment": {
    "validation_type": "STATIC",
    "network": "none",
    "credentials": "synthetic-only"
  },
  "repository": {
    "uri": "cases/FAS-019/repository",
    "commit": "phase3-initial",
    "artifact_digest": {
      "sha256": "0000000000000000000000000000000000000000000000000000000000000000",
      "media_type": "application/json",
      "origin": "BENCHMARK"
    }
  },
  "metadata": {
    "case_version": "0.1.0"
  }
}
